{
  "taskId": "task-2026-10-10-001",
  "inputFiles": [
    { "path": "C:\\fixtures\\images\\img-001.jpg", "format": "JPG" },
    { "path": "C:\\fixtures\\images\\img-002.jpg", "format": "JPG" },
    { "path": "C:\\fixtures\\images\\img-003.png", "format": "PNG" }
  ],
  "operation": { "kind": "RESIZE", "maxLongEdgePx": 1600 },
  "metadataPolicy": { "preserveCaptureDate": true },
  "outputDirectory": "C:\\fixtures\\out",
  "qualityPolicy": { "oracle": "NO_OBVIOUS_DEGRADATION_V1", "ssimThreshold": 0.95 },
  "networkUsage": "LOCAL_ONLY"
}
